{"$schema":"https://json-schema.org/draft/2020-12/schema","title":"APBRA engineering Task Contract v1 bootstrap refinement","type":"object","additionalProperties":false,"required":["schema_version","task_id","work_item_system","execution_id","human_owner","assigned_agent","agent_card_version","risk_class","objective","requirements","adrs","architecture_refs","allowed_paths","restricted_paths","acceptance_criteria","verification_required","out_of_scope","escalate_when","task_mode","readiness","actual_authenticated_actor","human_initiator","base_commit","branch","source_ids","owner_acceptance","effective_release","dependencies"],"properties":{"schema_version":{"const":1},"task_id":{"type":"string","pattern":"^APBRA-[1-9][0-9]*$"},"work_item_system":{"const":"jira"},"execution_id":{"type":"string","minLength":1},"human_owner":{"type":"string","minLength":1},"assigned_agent":{"type":"string","pattern":"^APBRA-[A-Z]+(?:-[A-Z]+)*$"},"agent_card_version":{"type":"string","minLength":1},"risk_class":{"enum":["R1","R2","R3","R4"]},"objective":{"type":"string","minLength":1},"requirements":{"type":"array","minItems":1,"uniqueItems":true,"items":{"type":"string","minLength":1}},"adrs":{"type":"array","minItems":1,"uniqueItems":true,"items":{"type":"string","minLength":1}},"architecture_refs":{"type":"array","minItems":1,"uniqueItems":true,"items":{"type":"string","minLength":1}},"allowed_paths":{"type":"array","minItems":1,"uniqueItems":true,"items":{"type":"string","minLength":1}},"restricted_paths":{"type":"array","minItems":1,"uniqueItems":true,"items":{"type":"string","minLength":1}},"acceptance_criteria":{"type":"array","minItems":1,"uniqueItems":true,"items":{"type":"string","minLength":1}},"verification_required":{"type":"array","minItems":1,"uniqueItems":true,"items":{"type":"string","minLength":1}},"out_of_scope":{"type":"array","minItems":1,"uniqueItems":true,"items":{"type":"string","minLength":1}},"escalate_when":{"type":"array","minItems":1,"uniqueItems":true,"items":{"type":"string","minLength":1}},"task_mode":{"enum":["SPECIFICATION","IMPLEMENTATION","REVIEW"]},"readiness":{"enum":["READY_FOR_SPECIFICATION","READY_FOR_IMPLEMENTATION","NEEDS_REFINEMENT","NEEDS_OWNER_ACCEPTANCE","BLOCKED_EXTERNAL"]},"actual_authenticated_actor":{"type":"string","minLength":1},"human_initiator":{"type":"string","minLength":1},"base_commit":{"type":"string","pattern":"^[0-9a-f]{40}$"},"branch":{"type":"string","minLength":1},"source_ids":{"type":"array","minItems":1,"uniqueItems":true,"items":{"type":"string","minLength":1}},"owner_acceptance":{"enum":["BOOTSTRAP_ONLY","PENDING","RECORDED"]},"effective_release":{"type":"string","minLength":1},"dependencies":{"type":"array","minItems":1,"uniqueItems":true,"items":{"type":"string","minLength":1}}}}
