{
  "schema_version": 1,
  "task_id": "APBRA-131",
  "work_item_system": "jira",
  "execution_id": "CAPSTONE-20260917-KNOWLEDGE",
  "human_owner": "Haseeb Ul Haque",
  "assigned_agent": "APBRA-DEVOPS",
  "agent_card_version": "0.1",
  "risk_class": "R3",
  "objective": "Implement bounded local curated APBRA90 reporting standards retrieval and citation evaluation preview.",
  "requirements": [
    "APBRA-131 acceptance",
    "APBRA-128 bounded golden flow"
  ],
  "adrs": [
    "ADR-055 selected React/TypeScript/Vite direction"
  ],
  "architecture_refs": [
    "21.03 v2"
  ],
  "allowed_paths": [
    "apps/web/src/knowledge.ts",
    "apps/web/src/knowledge.test.tsx",
    "apps/web/src/KnowledgePanel.tsx",
    "apps/web/src/App.tsx",
    "apps/web/README.md"
  ],
  "restricted_paths": [
    "apps/api/**",
    "packages/**",
    "workers/**",
    "infrastructure/**",
    ".env*"
  ],
  "acceptance_criteria": [
    "Deterministic sales-v1 adapter retrieves frozen curated corporate rules with source and citation provenance.",
    "Independent browser preview identifies the curated source without claiming integrated DesignPlan use.",
    "Evaluation checks mandatory citation coverage and rejects missing or unknown citations."
  ],
  "verification_required": [
    "npm ci --ignore-scripts",
    "npm test",
    "npm run build",
    "python scripts/check_ci_policy.py",
    "python scripts/check_bootstrap.py",
    "python -m unittest discover -s tests/bootstrap -v",
    "Hosted scanner and separate review"
  ],
  "out_of_scope": [
    "DesignPlan generation and full golden flow integration",
    "Commercial RAG, model or cloud services",
    "Production authorization or security assurance"
  ],
  "escalate_when": [
    "Source contradiction",
    "Dependency or tests unavailable"
  ],
  "task_mode": "IMPLEMENTATION",
  "readiness": "READY_FOR_IMPLEMENTATION",
  "actual_authenticated_actor": "Codex implementation execution via haseebulhaque authenticated GitHub connection",
  "human_initiator": "Haseeb Ul Haque",
  "base_commit": "5c79b54b36c5153677e80095ab19c4c39ec65408",
  "branch": "agent/APBRA-DEVOPS/APBRA-131-curated-knowledge",
  "source_ids": [
    "capstone-curated-knowledge"
  ],
  "owner_acceptance": "RECORDED",
  "effective_release": "MVP 0.1 - Capstone",
  "dependencies": [
    "APBRA90 frozen fixtures and APBRA129 merged shell; APBRA132/136 future integration"
  ]
}
