{
  "schema_version": 1,
  "task_id": "APBRA-132",
  "work_item_system": "jira",
  "execution_id": "CAPSTONE-20260917-132",
  "human_owner": "Haseeb Ul Haque",
  "assigned_agent": "APBRA-DEVOPS",
  "agent_card_version": "0.1",
  "risk_class": "R3",
  "objective": "Create and persist a strict versioned DesignPlan from confirmed requirements and curated evidence.",
  "requirements": [
    "APBRA-132 acceptance",
    "APBRA-128 bounded golden flow"
  ],
  "adrs": [
    "ADR-055 selected React/TypeScript/Vite direction"
  ],
  "architecture_refs": [
    "21.03 v2"
  ],
  "allowed_paths": [
    "apps/web/src/designPlan.ts",
    "apps/web/src/designPlan.test.ts",
    "apps/web/src/App.tsx",
    "apps/web/README.md"
  ],
  "restricted_paths": [
    "apps/api/**",
    "packages/**",
    "workers/**",
    "infrastructure/**",
    ".env*"
  ],
  "acceptance_criteria": [
    "Strict runtime schema/semantic validation rejects altered requirements, evidence versions, output bindings and unknown plan fields.",
    "Plan covers tables, relationships, measures, pages, visuals, filters and explicit no-RLS intent.",
    "Browser creates and exposes a source-bound plan with JSON download; edits invalidate it."
  ],
  "verification_required": [
    "npm ci --ignore-scripts",
    "npm test",
    "npm run build",
    "python scripts/check_ci_policy.py",
    "python scripts/check_bootstrap.py",
    "python -m unittest discover -s tests/bootstrap -v",
    "Hosted scanner and separate review"
  ],
  "out_of_scope": [
    "Power BI generation and runtime verification",
    "LLM interpretation, cloud services and commercial backlog"
  ],
  "escalate_when": [
    "Source contradiction",
    "Dependency or tests unavailable"
  ],
  "task_mode": "IMPLEMENTATION",
  "readiness": "READY_FOR_IMPLEMENTATION",
  "actual_authenticated_actor": "Codex implementation execution via haseebulhaque authenticated GitHub connection",
  "human_initiator": "Haseeb Ul Haque",
  "base_commit": "51b2aaccc3c479c97e5089f039c34f404a61b688",
  "branch": "agent/APBRA-DEVOPS/APBRA-132-design-plan",
  "source_ids": [
    "capstone-design-plan"
  ],
  "owner_acceptance": "RECORDED",
  "effective_release": "MVP 0.1 - Capstone",
  "dependencies": [
    "Merged APBRA-130 requirements and APBRA-131 curated adapter; APBRA-133 consumes validated plan"
  ]
}
