{
  "schema_version": 1,
  "task_id": "APBRA-160",
  "work_item_system": "jira",
  "execution_id": "APBRA-160-20261007-LOCAL-REKEY-REG",
  "human_owner": "Haseeb Ul Haque",
  "assigned_agent": "APBRA-DEVOPS",
  "agent_card_version": "0.1",
  "risk_class": "R4",
  "objective": "Register a three-path, owner-operated local encrypted credential rekey utility; code preparation and synthetic qualification only.",
  "requirements": [
    "Owner approved safe local recovery preparation at 08:12 UTC on 7 October 2026; parent dispatch explicitly authorizes finite registration before product edits, reviewed synthetic-only implementation and hidden-prompt handoff. Jira APBRA-160 PLAN 10605 records this direct authority. The existing Confluence 03.08 v3 source is historical context for protected credential references, not a claim it accepted this new recovery utility.",
    "Preserve every credential reference ID, company/profile associated-data binding, created metadata, revocation state and immutable Tenant Settings/history. Re-encrypt existing rows in place using authenticated AES-GCM, fresh nonces and a distinct active key version; authenticate old and replacement ciphertext before one atomic commit. Include revoked and historically referenced rows; never replace the provider credential or settings references.",
    "Owner personally generates and enters replacements locally through hidden TTY prompts. No secrets in arguments, echo, logs, exceptions, plaintext files, public evidence or chat. Fail closed without TTY, malformed keyrings, absent historical keys, wrong target confirmation, missing backup/maintenance acknowledgement, database/protocol failures or failed authentication. Bounded fixed error messages only.",
    "Utility is a maintenance operation with PostgreSQL transaction/locking, preview-only explicit target confirmation, dry-run default and a separate explicit commit confirmation. No provider/network/cloud operation other than the explicitly selected local database. Require local-loopback PostgreSQL target and restrict to development/test profile. Do not implicitly use environment bootstrap or seed credentials.",
    "Agents implement and test only synthetic keys, credentials and isolated disposable data. Do not read/decrypt/re-encrypt real provider credentials, generate or submit live replacements, execute on real data, edit preview/security settings, remove old keys, rotate provider credentials, delete evidence, install preview changes or make paid calls. Local user execution requires separate coordinated handoff and explicit authorization.",
    "Keep old-key recovery for existing encrypted database backups. Successful current-row rekeying does not sanitize retained backups or private tool-output retention and does not prove production security. Saved report request, CSV, evidence, history and protected artifacts remain untouched."
  ],
  "adrs": [
    "Separate registration, implementation, independent exact-head review, hosted CI and authorized manual merges. Registration itself changes governance only. This task does not broaden existing editable-draft 26 paths.",
    "No bulk rekey facility currently exists. Add narrow store support and an owner-operated CLI; preserve identity/AAD and perform atomic authenticated migration rather than provider-secret replacement. No schema or dependency changes."
  ],
  "architecture_refs": [
    "SECURITY.md at base 92cd56be9b3b275703225640f2fe90c7875f653e: private notification and coordinated affected-credential recovery; no public exposure claim.",
    "Existing tenant_secrets.py AES-GCM versioned keyring and TenantSecretRow contract; credential replacement endpoint revokes old references and is not suitable for preserving historical decryptability.",
    "Jira APBRA-160 PLAN 10605 and owner/parent direct recovery dispatch, 7 October 2026. Existing source-register remains byte-for-byte unchanged; historical Confluence acceptance is not relabelled."
  ],
  "allowed_paths": [
    "apps/api/src/apbra_api/tenant_secrets.py",
    "apps/api/src/apbra_api/rekey_tenant_secrets.py",
    "apps/api/tests/test_rekey_tenant_secrets.py"
  ],
  "restricted_paths": [
    ".github/**",
    "docs/**",
    "tasks/**",
    "scripts/**",
    "tests/bootstrap/**",
    "apps/api/src/apbra_api/api.py",
    "apps/api/src/apbra_api/persistence.py",
    "apps/api/src/apbra_api/domain.py",
    "apps/api/alembic/**",
    "apps/api/pyproject.toml",
    "apps/api/requirements*.txt",
    "apps/web/**",
    "compose.yaml",
    "infrastructure/**",
    "terraform/**",
    "workers/**",
    "packages/**"
  ],
  "acceptance_criteria": [
    "Registration changes exactly its three governance files and no product code; all 84 source rows and existing task authorities remain unchanged. Future product changes stay within exactly three literal paths.",
    "Synthetic authenticated rekey preserves IDs, historical settings references, AAD, metadata and plaintext semantics; every-row output is verified before atomic commit. Wrong/missing keys, tampering, malformed config and interrupted/failing updates leave all rows unchanged.",
    "Hidden TTY prompts, safe target selection, backup/maintenance and commit confirmations, dry-run/rollback behavior and redacted errors are tested without real credentials. No secret appears in output; no provider call or live preview operation occurs.",
    "User handoff specifies local secure entry, coordinated restart with retained historical keys, non-secret data/reference checks, rollback and old-backup decryptability limits; no untested live recipe."
  ],
  "verification_required": [
    "Registration: focused scope/gate/path mutation tests including digest-recomputed mutations, historical source/task preservation, full bootstrap suite, bootstrap/CI policy/diff checks, independent exact-head PASS and hosted CI.",
    "Implementation only after registration gates and merge: synthetic isolated PostgreSQL transaction/concurrency/rollback and unit prompt/error tests, API Ruff/strict mypy, relevant full API suite, governance/checkers, exact-head independent review and hosted CI. No agent real-data execution."
  ],
  "out_of_scope": [
    "Real credential reads/decryption/rekey execution; replacement live-secret generation/entry, provider rotation, old-key removal, preview install, session/database-password rotation, file deletion or security-setting mutation.",
    "Migration/schema, API endpoint, settings/history, provider, cloud, hosting, dependencies, workflows and existing product scopes; paid calls or production assurance claims."
  ],
  "escalate_when": [
    "Any implementation exceeds three literal paths, needs schema/dependency changes, logs raw exceptions/secrets, changes reference identity/history, lacks atomicity or requires real secret access.",
    "Hosted CI, independent exact-head PASS or authorized manual merge is missing/stale/failed; registration must merge before product edits.",
    "Real execution is contemplated without owner-operated secure handoff, recovery backup, coordinated maintenance and exact approved target."
  ],
  "dependencies": [
    "PR109 is independent and remains separately gated; do not mix changes or install recovery code into preserved preview.",
    "Direct owner recovery preparation authority recorded in Jira 10605; existing APBRA-174 protected-reference source retained unchanged as historical context."
  ],
  "task_mode": "IMPLEMENTATION",
  "readiness": "READY_FOR_IMPLEMENTATION",
  "actual_authenticated_actor": "Codex via haseebulhaque authenticated GitHub and Atlassian tools",
  "human_initiator": "Haseeb Ul Haque",
  "base_commit": "92cd56be9b3b275703225640f2fe90c7875f653e",
  "branch": "agent/APBRA-DEVOPS/APBRA-160-local-rekey",
  "source_ids": [
    "mvp1-model-led-clarification-flexible-generation-delivery-guide"
  ],
  "owner_acceptance": "RECORDED",
  "effective_release": "Code preparation only after registration exact-head hosted CI, independent PASS, authorized manual merge and verified main; live execution remains prohibited for agents."
}
